{
  "id": "opp-20260908-creator-audio-leveler",
  "cluster_id": "cluster-2026-creator-audio-normalization",
  "title": "Local Mac Menu Bar Audio Normalizer for Video Creators",
  "one_liner": "A drag-and-drop macOS utility that instantaneously balances multi-track audio to YouTube -14 LUFS without cloud uploads.",
  "evaluated_at": "2026-09-08T10:15:00Z",
  "evaluator": "llm",
  "dimensions": {
    "pain_intensity": {
      "score": 6,
      "weight": 0.15,
      "evidence": "Annoying delay during final video exports, but not a catastrophic business killer for most creators.",
      "rubric_tier": "moderate_4_6"
    },
    "frequency": {
      "score": 6,
      "weight": 0.08,
      "evidence": "Occurs 1-3 times a week during scheduled publication windows.",
      "rubric_tier": "moderate_4_6"
    },
    "workaround_friction": {
      "score": 5,
      "weight": 0.15,
      "evidence": "Creators use manual volume keyframes or free Audacity plugins; tedious but functional.",
      "rubric_tier": "moderate_4_6"
    },
    "paying_intent": {
      "score": 5,
      "weight": 0.20,
      "evidence": "Willing to pay a small one-off Gumroad fee ($29-$49), but high churn and reluctance for recurring SaaS subscriptions.",
      "rubric_tier": "moderate_4_6"
    },
    "cross_source_recurrence": {
      "score": 6,
      "weight": 0.07,
      "evidence": "Found across X/Twitter and r/premiere, but mostly expressed as occasional workflow gripes.",
      "rubric_tier": "moderate_4_6"
    },
    "competitive_gap": {
      "score": 5,
      "weight": 0.10,
      "evidence": "Auphonic, Descript, and Premiere Auto-Match exist; however, they require heavy uploads or complex multi-step settings.",
      "rubric_tier": "moderate_4_6"
    },
    "feasibility_solo_buildability": {
      "score": 8,
      "weight": 0.10,
      "evidence": "Straightforward macOS Swift app wrapping ffmpeg / libebur128 audio loudness filter.",
      "rubric_tier": "strong_7_8"
    },
    "distribution_accessibility": {
      "score": 6,
      "weight": 0.15,
      "evidence": "YouTube creator community is large but fragmented; requires influencer word-of-mouth or short-form video marketing.",
      "rubric_tier": "moderate_4_6"
    }
  },
  "total_weighted_score": 57.5,
  "hard_kill_filters": {
    "pain_intensity_below_6": false,
    "paying_intent_below_5": false,
    "unsolvable_for_solo_builder": false,
    "zero_distribution_channel": false,
    "is_killed": false,
    "kill_reason": null
  },
  "recommendation": "archive_or_monitor",
  "next_action": "Archive and monitor. Adobe and Apple Final Cut Pro are likely to roll out native one-click AI loudness normalization in upcoming minor releases."
}
